{
  "codigo_peca": "recurso_inominado",
  "nome_peca": "Recurso Inominado",
  "requisitos": [
    {
      "codigo": "recorrente",
      "nome": "Recorrente",
      "categoria": "identificacao",
      "obrigatoriedade": "obrigatorio",
      "tipo_dado": "texto",
      "descricao": "Identificação da parte que interpõe o recurso.",
      "validacao": {},
      "consequencia": "Sem a identificação do recorrente, a peça não pode ser finalizada."
    },
    {
      "codigo": "recorrido",
      "nome": "Recorrido",
      "categoria": "identificacao",
      "obrigatoriedade": "obrigatorio",
      "tipo_dado": "texto",
      "descricao": "Identificação da parte contra a qual o recurso é dirigido.",
      "validacao": {},
      "consequencia": "Sem a identificação do recorrido, a peça não pode ser finalizada."
    },
    {
      "codigo": "numero_processo",
      "nome": "Número do processo",
      "categoria": "identificacao",
      "obrigatoriedade": "obrigatorio",
      "tipo_dado": "texto",
      "descricao": "Número identificador do processo judicial.",
      "validacao": {
        "necessario_para": [
          "identificacao_processual"
        ]
      },
      "consequencia": "A peça não deve ser finalizada sem a identificação do processo."
    },
    {
      "codigo": "juizo_origem",
      "nome": "Juízo de origem",
      "categoria": "processual",
      "obrigatoriedade": "obrigatorio",
      "tipo_dado": "texto",
      "descricao": "Juízo perante o qual tramita ou tramitou o processo em primeiro grau.",
      "validacao": {},
      "consequencia": "Necessário para a correta identificação da origem do recurso."
    },
    {
      "codigo": "turma_recursal",
      "nome": "Turma Recursal competente",
      "categoria": "processual",
      "obrigatoriedade": "obrigatorio",
      "tipo_dado": "texto",
      "descricao": "Órgão colegiado competente para julgamento do recurso.",
      "validacao": {},
      "consequencia": "O endereçamento não deve ser finalizado sem a identificação do órgão competente."
    },
    {
      "codigo": "sentenca_impugnada",
      "nome": "Sentença impugnada",
      "categoria": "cabimento",
      "obrigatoriedade": "obrigatorio",
      "tipo_dado": "documento",
      "descricao": "Decisão judicial objeto do Recurso Inominado.",
      "validacao": {
        "necessario_para": [
          "cabimento",
          "resumo_da_lide",
          "fundamentacao"
        ]
      },
      "consequencia": "Sem a sentença ou seu conteúdo verificável, não é possível estruturar adequadamente a impugnação."
    },
    {
      "codigo": "tipo_decisao",
      "nome": "Tipo da decisão impugnada",
      "categoria": "cabimento",
      "obrigatoriedade": "obrigatorio",
      "tipo_dado": "texto",
      "descricao": "Identificação da natureza da decisão que se pretende impugnar.",
      "validacao": {
        "regra": "Deve ser compatível com o cabimento do Recurso Inominado."
      },
      "consequencia": "Se a decisão não for compatível com o recurso, o sistema deve sinalizar possível inadequação recursal."
    },
    {
      "codigo": "data_ciencia",
      "nome": "Data da ciência da sentença",
      "categoria": "tempestividade",
      "obrigatoriedade": "obrigatorio",
      "tipo_dado": "data",
      "descricao": "Data efetivamente identificada nos autos como marco de ciência da sentença.",
      "validacao": {
        "necessario_para": [
          "tempestividade"
        ]
      },
      "consequencia": "Sem a data de ciência, a tempestividade não pode ser verificada com segurança."
    },
    {
      "codigo": "data_interposicao",
      "nome": "Data da interposição",
      "categoria": "tempestividade",
      "obrigatoriedade": "obrigatorio",
      "tipo_dado": "data",
      "descricao": "Data em que o recurso foi ou será efetivamente interposto.",
      "validacao": {
        "necessario_para": [
          "tempestividade"
        ]
      },
      "consequencia": "Sem a data de interposição, a tempestividade não pode ser verificada."
    },
    {
      "codigo": "situacao_preparo",
      "nome": "Situação do preparo",
      "categoria": "preparo",
      "obrigatoriedade": "obrigatorio",
      "tipo_dado": "enum",
      "opcoes": [
        "recolhido",
        "gratuidade_concedida",
        "gratuidade_requerida",
        "isento",
        "nao_informado"
      ],
      "descricao": "Situação processual relativa ao preparo recursal.",
      "validacao": {
        "regra": "A situação deve ser confirmada a partir dos autos ou das informações fornecidas."
      },
      "consequencia": "O sistema deve sinalizar ausência de informação suficiente sobre o preparo."
    },
    {
      "codigo": "comprovante_preparo",
      "nome": "Comprovante de preparo",
      "categoria": "preparo",
      "obrigatoriedade": "condicional",
      "tipo_dado": "documento",
      "descricao": "Comprovante do recolhimento do preparo quando houver obrigação de recolhimento.",
      "validacao": {
        "condicao": "Obrigatório quando a situação do preparo for recolhido."
      },
      "consequencia": "A ausência do comprovante deve ser sinalizada para conferência."
    },
    {
      "codigo": "gratuidade_justica",
      "nome": "Situação da gratuidade da justiça",
      "categoria": "gratuidade",
      "obrigatoriedade": "condicional",
      "tipo_dado": "enum",
      "opcoes": [
        "concedida",
        "requerida",
        "indeferida",
        "nao_requerida",
        "nao_informada"
      ],
      "descricao": "Situação da assistência judiciária gratuita relacionada ao recurso.",
      "validacao": {
        "condicao": "Verificar quando houver alegação, pedido ou decisão relativa à gratuidade."
      },
      "consequencia": "Se houver pedido de gratuidade, sua situação deve ser expressamente identificada."
    },
    {
      "codigo": "fatos_relevantes",
      "nome": "Fatos relevantes",
      "categoria": "demanda",
      "obrigatoriedade": "obrigatorio",
      "tipo_dado": "texto",
      "descricao": "Fatos necessários à compreensão da controvérsia recursal.",
      "validacao": {},
      "consequencia": "A ausência de fatos suficientes impede a construção segura da fundamentação."
    },
    {
      "codigo": "pedidos_iniciais",
      "nome": "Pedidos formulados na demanda",
      "categoria": "demanda",
      "obrigatoriedade": "obrigatorio",
      "tipo_dado": "texto",
      "descricao": "Pedidos originalmente formulados pela parte autora.",
      "validacao": {},
      "consequencia": "Necessário para compreender a extensão da controvérsia."
    },
    {
      "codigo": "defesa",
      "nome": "Defesa apresentada",
      "categoria": "demanda",
      "obrigatoriedade": "obrigatorio",
      "tipo_dado": "documento",
      "descricao": "Contestação ou manifestação defensiva relevante para a compreensão da controvérsia.",
      "validacao": {},
      "consequencia": "A ausência deve ser sinalizada quando a defesa for relevante para o recurso."
    },
    {
      "codigo": "resultado_sentenca",
      "nome": "Resultado da sentença",
      "categoria": "sentenca",
      "obrigatoriedade": "obrigatorio",
      "tipo_dado": "texto",
      "descricao": "Resultado efetivamente produzido pela sentença.",
      "validacao": {},
      "consequencia": "Necessário para determinar o objeto da insurgência recursal."
    },
    {
      "codigo": "capitulos_impugnados",
      "nome": "Capítulos da sentença impugnados",
      "categoria": "recursal",
      "obrigatoriedade": "obrigatorio",
      "tipo_dado": "lista",
      "descricao": "Identificação individualizada dos capítulos ou conclusões da sentença que serão objeto de impugnação.",
      "validacao": {
        "regra": "Cada capítulo impugnado deve possuir fundamento recursal correspondente."
      },
      "consequencia": "Não se deve redigir fundamentação genérica sem identificar o objeto efetivo da insurgência."
    },
    {
      "codigo": "objetivo_recursal",
      "nome": "Objetivo do recurso",
      "categoria": "recursal",
      "obrigatoriedade": "obrigatorio",
      "tipo_dado": "texto",
      "descricao": "Resultado processual pretendido com o recurso.",
      "validacao": {},
      "consequencia": "Os pedidos devem corresponder diretamente ao objetivo recursal."
    },
    {
      "codigo": "teses_recursais",
      "nome": "Teses recursais",
      "categoria": "fundamentacao",
      "obrigatoriedade": "obrigatorio",
      "tipo_dado": "lista",
      "descricao": "Fundamentos jurídicos individualizados destinados à reforma ou anulação da sentença.",
      "validacao": {
        "regra": "Cada tese deve possuir relação identificável com fatos, provas, fundamentos jurídicos e resultado pretendido."
      },
      "consequencia": "Sem tese recursal definida, a IA não deve inventar fundamentos para preencher a peça."
    },
    {
      "codigo": "provas_relacionadas",
      "nome": "Provas relacionadas às teses",
      "categoria": "fundamentacao",
      "obrigatoriedade": "condicional",
      "tipo_dado": "lista",
      "descricao": "Documentos ou outros elementos probatórios relacionados às teses recursais.",
      "validacao": {
        "condicao": "Obrigatório quando a tese depender de demonstração probatória."
      },
      "consequencia": "A ausência deve ser sinalizada quando a argumentação depender de prova não localizada."
    },
    {
      "codigo": "fundamentos_juridicos",
      "nome": "Fundamentos jurídicos",
      "categoria": "fundamentacao",
      "obrigatoriedade": "obrigatorio",
      "tipo_dado": "lista",
      "descricao": "Normas, princípios e demais fundamentos jurídicos pertinentes às teses recursais.",
      "validacao": {
        "regra": "Os fundamentos devem ser vinculados às respectivas teses."
      },
      "consequencia": "Não devem ser inseridos dispositivos legais sem relação identificável com a tese."
    },
    {
      "codigo": "dispositivos_prequestionamento",
      "nome": "Dispositivos para prequestionamento",